id,text,author,likes,timestamp,is_reply,parent_id
UgzXzBTN80iGM9fzWfB4AaABAg,"I’m all for these companies being less profitable, but so they can pay their workers more, not so they can cover Trump‘a stupid tariff war.",@JessieBanana,1,1747609200,False,
UgzN7HL1XnY4QEbgGl14AaABAg,How did Beasant make any money on Wall Street. Who would hire him? Was he a DEI homo hire? Oh nothing wrong with being a Gay banker. Oh unless  you are Ultra MAGa anti homo.,@wingninchan,1,1747609200,False,
UgxdNKxlFQJc7RCvyHR4AaABAg,WHAT A RACISTS DOUCH 🙄😒😕😑😐😳🙄😒😕😮😢😢😢😢,@carlapaschall5768,1,1747612800,False,
UgxAmeV0w1BxY5uxKJB4AaABAg.AIHUH3o6ShIAIH_akBwkWH,"no, the capitalist economic machine is continuing self interest and is resisting and defying the corrective measures the president is struggling to put into place. would be great if you could just understand his intent and purpose, which you don't, and support your president and country, which you don't. you think you do but you're in a cult of hatred and you're blind and lost. wake up.",@OrchestralOrg,1,1747612800,True,UgxAmeV0w1BxY5uxKJB4AaABAg
UgyC4qw-cfdPbROfrB54AaABAg,"Any price reductions that he’s talking about like gas came as a result of our economy tanking, not because of specific efforts by the Trump administration to do anything about them directly.",@sharkysharkerson,1,1747609200,False,
Ugy3hCo_YphlweE7jix4AaABAg,Grocery prices sure have gone up!  Groceries?  such an old fashioned word!  Why have I never heard it before?,@wheezysqueezebox7651,1,1747612800,False,
Ugxt4i_9IhDLLI_RXAV4AaABAg,Chris!! I love your news!!! Keep up the good work!!,@RationalThinker77,1,1747612800,False,
Ugw-lvC0NK8QevKzF7F4AaABAg,"😃 😀 😄 😁 🤣 😂 the trumpers especially the veterans for trump who are the worshippers of the cult of donald john trump senior who was not awesome as the MAGA Trumpers preach, simply, if donald john trump senior is the best ever to occupy the white house, the the bone spurs commander in grift\graft donald john trump senior should had been reelected by winning 49 states on november 2020 leap year that ronald wilson reagan actually won 49 states on november 1984 to be reelected | 3:56 pm Pacific DayLight Savings Time, sinDAY, 18 may 2025",@maxwaller8344,1,1747609200,False,
UgzeQmHVmXtkPrK1bT54AaABAg.AIHTW3rPN_hAIHToXUVaIT,Threatened my country with annexation or invasion... Your President is actually insane.,@Eldritch-1,1,1747609200,True,UgzeQmHVmXtkPrK1bT54AaABAg
UgxPzhHgI9fYfl8P2Rh4AaABAg,Walmart 😅. Who shops there,@sophiapetersen614,1,1747609200,False,
UgzIc9hadv2XjInXlx54AaABAg,LYING LYING LYING RACISTS THUG ASS HOLE YUCK 🤮😐😒🙄😑😤🤮😐😒🙄😑😤🤮😐,@carlapaschall5768,1,1747612800,False,
UgxkKJAHqJVxPRja2mN4AaABAg,Do you think bassent understands that his career is over?,@zingbat4,1,1747609200,False,
UgxNgcTEPGuHj5LGHgp4AaABAg,"Speaking of ""eating""... They literally had to bring ""Mr. McClassy"" a mobile McDonalds to Saudi Arabia... Biden eats ice cream during a bicycle ride and it was front page news but this... this just slips by?",@Darth.Shredder,1,1747609200,False,
UgwfZzYasebT86Qzrap4AaABAg,I’m printing my own unlimited money… I can sell you some bonds !!!,@markgriskey,1,1747609200,False,
UgxddR5YQFNioMr8q_94AaABAg,So hard to listen to these folks.,@TonyWeesner-ok2pp,1,1747609200,False,
UgwR4Ns4lm1fiZUhY9J4AaABAg,"Republicans lie about everything,  it's all gaslighting.",@Joshua-dw8wu,1,1747609200,False,
UgzQNyWNX5O8dRI7AgR4AaABAg,"""Your honor, I didn't shoot myself. He and I shot each other and realized it wasn't a good idea.""",@poopypants9983,1,1747609200,False,
UgyLtxBMmzexoNgJZOF4AaABAg.AIHQo9YRS1SAIHbrJR3naJ,"It's tRumps new definition of what's groceries; dogs, cats and tariffs. Plastic or paper?",@UnaKing-kh8jq,1,1747612800,True,UgyLtxBMmzexoNgJZOF4AaABAg
UgyCxN4w4edsqe1OyqN4AaABAg,"Fool me once, shame on you; fool me twice, shame on me, Yes American keep voted for criminal and idiot to run the country, Yes U.S.A number one...stupidity",@PixelMs-j4e,1,1747609200,False,
UgxAfm8ZPS4ZCVPuLEB4AaABAg.AIHQatQ2BUNAIHTkPmh3DB,"Unless he declares a state of emergency and becomes president for life. Then  it'll Don Jr,  Barron and so on. It'll  be a hoot.",@Jebediah1999,1,1747609200,True,UgxAfm8ZPS4ZCVPuLEB4AaABAg
UgxpHw2PIU4GWxhOZyl4AaABAg,"Trump vs. capitalism.  Round one, fight!
What's he going to do?  With Walmart employees already being subsidised by the government because of low pay, is he going to subsidize prices for the consumer?  Is he going to implement price fixing on Walmart?  Is he going to force the treasury to cut rates while inflation goes up?",@psybertao,1,1747605600,False,
Ugyf6k1UCkNnyHQVEkN4AaABAg.AIHQTsd4syDAIHXOpgLcNV,OMG… how can you judge another citizens purchases with their hard earned cash!,@josephinestokes-r4g,1,1747609200,True,Ugyf6k1UCkNnyHQVEkN4AaABAg
UgwMloF8ugsZPgsPDmZ4AaABAg,"Scott Bessent should not have taken that cabinet position, he's not built for it. He should have taken his money and run away to Europe or Canada. This disrespect towards China is the erroneous belief in the superiority of the white man and  America vs the whole world.",@suimeingwong2043,1,1747605600,False,
UgyxQkvoflZptuOeQe14AaABAg,Up in Anniston Alabama.,@jamesbarron2258,1,1747605600,False,
Ugy5waeDcgllHH9oT9Z4AaABAg.AIHQ88WXdU4AIHZNyjYFRc, @android12921  yep you said it. Things I think are utterly insane and incomprehensible it's been said by MAGA supporters. People have heard Trump speak and yet they still think he's a genius.,@champ8605,1,1747612800,True,Ugy5waeDcgllHH9oT9Z4AaABAg
Ugy5waeDcgllHH9oT9Z4AaABAg.AIHQ88WXdU4AIHZgCLsjAi,Waste of time talking to a person who don't know who pays the tariffs. Maybe we should ask ourselves who collects and keeps the tariffs?,@jefftan4052,1,1747612800,True,Ugy5waeDcgllHH9oT9Z4AaABAg
UgxsxSEV7j-klEnDadB4AaABAg.AIHQ18a9BqdAIHbSjr6MQ9,@ How high were they around the year 2000? Or a better question how much were people in minimum wage jobs generally getting paid back then?,@Trindy1,1,1747612800,True,UgxsxSEV7j-klEnDadB4AaABAg
UgyoxpwVY8Sn7QcDosB4AaABAg,"This is EXACTLY what Trmp said during the first term.  Trump was going to build the wall, and Mexico was going to pay for it.",@adrienne8211,1,1747605600,False,
UgxIngG2zSWR3fPfhgB4AaABAg.AIHPwsgNMk8AIHUvhoTbhO,Tell Trump that; he was boasting gas prices were going down because of him. 🙄,@lmo3264,1,1747609200,True,UgxIngG2zSWR3fPfhgB4AaABAg
Ugy_fDQMYqZZ7pUMOEZ4AaABAg.AIHPpbZY-jYAIHT5wX7Pcq, @raymondwilmont8103  trump's working on it!,@A.G.P.115,1,1747609200,True,Ugy_fDQMYqZZ7pUMOEZ4AaABAg
Ugx-V12iiDZ3EXiFTa94AaABAg.AIHPotUdrssAIHU_jAzT7J,"​ @jeanieologist4456  I think he means don't feed ""dark people."" Even if it means food rots and US farmers are cheated out of income. Key thing is, don't help ""dark people.""",@lukehauser1182,1,1747609200,True,Ugx-V12iiDZ3EXiFTa94AaABAg
Ugx-V12iiDZ3EXiFTa94AaABAg.AIHPotUdrssAIHXMWOohAL, @jeanieologist4456 he’s talking out his exit.,@chucktaylor4958,1,1747609200,True,Ugx-V12iiDZ3EXiFTa94AaABAg
Ugx-V12iiDZ3EXiFTa94AaABAg.AIHPotUdrssAIHXSmfdWb8," @jeanieologist4456 Dont feed the wildlife, it makes the wildlife dependent on hand outs.",@cent50aplus,1,1747612800,True,Ugx-V12iiDZ3EXiFTa94AaABAg
Ugx-V12iiDZ3EXiFTa94AaABAg.AIHPotUdrssAIHafiJV27M,Who do they think they are. Remove trumps DRUG addled ads. Get REAL,@JohnAdie-pg6ky,1,1747612800,True,Ugx-V12iiDZ3EXiFTa94AaABAg
Ugx-V12iiDZ3EXiFTa94AaABAg.AIHPotUdrssAIHbp3grVfe,"@jeanieologist4456  my guy just saw a post on reddit regarding mres.  It's true.  They are selling them.  We have a case that states "" emergency food courtesy of usaid"".",@Epipusher007,1,1747612800,True,Ugx-V12iiDZ3EXiFTa94AaABAg
Ugx-V12iiDZ3EXiFTa94AaABAg.AIHPotUdrssAIHdW0cN8YD,That's the worst thing this administration has done ino,@ahklys1321,1,1747613640,True,Ugx-V12iiDZ3EXiFTa94AaABAg
Ugx-V12iiDZ3EXiFTa94AaABAg.AIHPotUdrssAIHfQ953X58,"@cent50aplus  It’s not altruistic and human beings are not “wildlife”.   The US helps other countries experiencing famine due to war, drought, disease etc. so that those problems STAY in the third world, and those people can survive in their own countries.  Or…would you prefer all those people come to the US where there is less war, drought and disease.   See?",@leaharchambault5796,1,1747614660,True,Ugx-V12iiDZ3EXiFTa94AaABAg
UgykAKtK7VyCvRtDagl4AaABAg.AIHPohMspZPAIHV3LuTd2J,Gas buddy says lowest price in the state is 2.92,@edmorey8140,1,1747609200,True,UgykAKtK7VyCvRtDagl4AaABAg
Ugwjy5celbr_8fnVCa14AaABAg,"Don't you think a clown horn honking whenever Chris says his trademark line... ""So the Donald Trump clown show continues..."" (*honk-honk*) would be great?",@boxvango9021,1,1747605600,False,
UgzAxE18ywkMx8gw3k54AaABAg.AIHPdVCIzmAAIHeUrAVS2A,"I have such a tough time watching and listening to Bessent- fidget hands, cough, cough, show his expensive veneers, ""um, um.."" & let the lies begin... 🤮🤮🤮",@toric6185,1,1747614180,True,UgzAxE18ywkMx8gw3k54AaABAg
UgzAxE18ywkMx8gw3k54AaABAg.AIHPdVCIzmAAIHgC1CzjjI,and he doesn't care,@Finaldayz-c4x,1,1747615080,True,UgzAxE18ywkMx8gw3k54AaABAg
UgzAxE18ywkMx8gw3k54AaABAg.AIHPdVCIzmAAIHh2LikxOM,and a terrible person.,@Frank-vn9rg,1,1747615500,True,UgzAxE18ywkMx8gw3k54AaABAg
Ugx9bwbI9vZLgauDSvJ4AaABAg,Lying Scott pissant. Traitors,@bushsawtville2226,1,1747605600,False,
Ugyhkcmyj5JXVcH2NBF4AaABAg.AIHPDDhDGmWAIHVSI1m5yQ,'Cough' 'cough' 'cough',@taylorkeane2295,1,1747609200,True,Ugyhkcmyj5JXVcH2NBF4AaABAg
UgxGXd5Y5NRj8JAJCFB4AaABAg,LIAR complete FRAUD,@jeanieologist4456,1,1747605600,False,
UgwmHlmn9mtdypD_4DF4AaABAg.AIHOrc0lGfeAIHUdVuGjpC,"We're not scaring anyone... 
He will escalate. 🚨",@BlueBonnie764,1,1747609200,True,UgwmHlmn9mtdypD_4DF4AaABAg
Ugy0lGAhsOFBTEpLWDV4AaABAg.AIHQv0KJrcEAIHU7NCYxN4,its like the guy has a bad poker face,@xSarahtonin,1,1747609200,True,Ugy0lGAhsOFBTEpLWDV4AaABAg
UgxMSKo_7WBJqs1oHYh4AaABAg,"Unless the companies lower prices because their transportation costs go down, it won't help. Poor people don't have cars.",@Missypop-sy8oc,1,1747609200,False,
UgzCi0K3gBmKAbUIvrh4AaABAg,"Chris, you know the truth. Tell it as it is. Everything is up in price. Do trust that fucked up orange man said.",@NobelMulat,1,1747609200,False,
Ugz2xIg0htEg5xH35aV4AaABAg,Is this Scott guy DEI?  Maybe he's an underground ICP juggalo,@msekstrom9137,1,1747609200,False,
Ugxzh1vThm0RtTR_X-x4AaABAg,"Trump will lie, his sheep will believe him. He's banking on their stupidity.",@JesseTucker-ux2dc,1,1747609200,False,
Ugz5CAc0E2JZ5LoHtQt4AaABAg,"Is that his version of ""Let them eat cake!""?",@boathousejoed1126,1,1747609200,False,
Ugxcl2RUlzzO0alBE9J4AaABAg,"How Tariffs work - The country that exports the products do not get billed at all.  Those who imported the goods from said country, well, when they arrive at the Port of Call, then when Customs releases them, the person who imported said goods must pay the fees for the goods that were imported.

If an item was $200, and the tariff on that item was 100%, they would receive a bill for $200 to release the item.  
So now, that $200 item actually cost $400. That's it. Explain how a country that is exporting the goods will pay that tariff, and on top of that, why would the exporting country want to?",@demcomp,1,1747609200,False,
Ugxcl2RUlzzO0alBE9J4AaABAg.AIHSkkjvQZfAIHXzfkV8gH, @demcomp  Cheers!,@davidbrayshaw3529,1,1747612800,True,Ugxcl2RUlzzO0alBE9J4AaABAg
UgxrlMmh3QdvsV9aj-p4AaABAg,"IMPEACH OR EVERYONE DIES- This isn't a threat. this is the last of America's common sense. 
This is gonna go so far fast sideways. 
No one will be stopping with just him. 
Save your own lives you cowards.",@chickenlittle2206,1,1747609200,False,
UgwtJCzV45A72-WQB5h4AaABAg,"21:17  hint: money in state politicians' pockets and sold land that belings to the 5 tribes. Employees will NOT be from Oklahoma, but brought in by the UAE, just like all the oil field workers. They strip Oklahomans' won't benefit but many will loose jobs, property and the state will be poluted irreparably.",@sumiland6445,1,1747609200,False,
Ugz9NhmReQfTc7yjwBt4AaABAg,"The problem with oil prices is that when they are as low as they are now (not because of Trump but to punish unreliable members of OPEC+), it is no longer worth producing oil in the USA because the costs are too high. At the very least, no more new boreholes will be drilled. It will be as nothing out of “drill baby drill” and additional jobs in this industry.",@911Crimson,1,1747609200,False,
UgwWhq-kzK35XXxeXyF4AaABAg,clown show.....NOT EVEN FUNNY,@hooker4749,1,1747609200,False,
UgxuvQRwm8R3eR4HP994AaABAg,"Hate to sound unpatriotic, but I'm with China. They are making deals all over the world at this very moment. tRump will be lucky if China doesn't reply to his letter with a dear john letter. Then what's he going to do? Claim victory? China has him over a barrel. He should tread lightly.",@lindaswanson9328,1,1747609200,False,
UgzYcXhzQ3NNNFGuC_l4AaABAg,"Truth? A majority of Americans are so fucking stupid they wouldn't even understand the truth, and this is what the administration knows already. They can say whatever and the magat parrots will just keep parroting it.",@eightiesallen3180,1,1747609200,False,
Ugx2OKSw0RQPhSciE_J4AaABAg,Is bessant a cartoon character?,@ChaoticAnswers,1,1747609200,False,
Ugyd41CeXtN2Nh3gbJ14AaABAg,I pledged 100 trillion and no one even noticed. 😂,@computersales,1,1747609200,False,
Ugyd41CeXtN2Nh3gbJ14AaABAg.AIHSDDBCs2eAIHSwu7Q4m_,I'll see you 1 triĺion and make it 3 trillion 😂😂😂😂😂😂😅😅😅😅,@rb2778,1,1747609200,True,Ugyd41CeXtN2Nh3gbJ14AaABAg
Ugzkxrt2HwIyGhvEgx54AaABAg.AIHS9ABzZkKAIHi1DBOMOx,Yes & Donald knows that game well.,@mattstansbeary3068,1,1747615980,True,Ugzkxrt2HwIyGhvEgx54AaABAg
UgyCHywYqmcoCUEu5Tl4AaABAg.AIHR1wOTXD3AIHTGHRBp8v,Hello. I am from Europe. Which negotiations are you talking about? No sane person will negotiate a deal with an administration that is constantly changing the rules?,@raquelzaragoza1142,1,1747609200,True,UgyCHywYqmcoCUEu5Tl4AaABAg
UgyXhs3LoQ85rq4sxkx4AaABAg,"Bissent when he really lies he ccughs, clears his throat and almost cries 15:10",@oswynjames8308,1,1747609200,False,
UgyXhs3LoQ85rq4sxkx4AaABAg.AIHS4eq0sQtAIHSLjaeEoA,"I think he will step down eventually, he's can't keep the coughing up :)",@realchris,1,1747609200,True,UgyXhs3LoQ85rq4sxkx4AaABAg
UgywkheKFRlxX8O8vUF4AaABAg.AIHS0zqKZb0AIHZk4tzJYT,"His pocket, is the taxpayers. Bank of Grift.",@michaelamo7593,1,1747612800,True,UgywkheKFRlxX8O8vUF4AaABAg
Ugzwdlv36QbllRHB0zx4AaABAg,"For me it is not who will pay for the tariffs,  Rather where is the tariff money going?  Who will control the tariff money slush fund? Will it be used to pay down the national debt?  I remember a clip in which Trump said we are all going to be rich.",@DPS0407,1,1747609200,False,
UgxbmFIM6_uXGBGg-NR4AaABAg,"The time of tariffs was before income taxes, so when are they ending? The time of the tariffs, 80% of the people were poor, 15% middle class and 5% elite. Trump talked tariffs, they voted to not only pay income taxes but high tariffs too.",@lunarminx,1,1747609200,False,
UgxaNK_l7eoi1e4HvRJ4AaABAg,So...🇨🇳 won't be paying the tariffs😅,@rgpenny1,1,1747609200,False,
UgxeDrXNWQiKcyF94Z54AaABAg,Gas prices are 20 cents up since orange donno in the office. CA,@pavel_mednykh,1,1747609200,False,
UgyNs28E6eyQcHXWrex4AaABAg.AIHRO2DXojZAIHUldkL2jx,Getting????,@taylorkeane2295,1,1747609200,True,UgyNs28E6eyQcHXWrex4AaABAg
UgzbjkH-yXaxP8RN9Ll4AaABAg,"Do people really not understand that the whole point of tariffs is to raise prices, thus making domestic products easier to sell? Forgive me, YouTube, but this is just a level of stupidity that cannot be ignored.",@stefanfrankel8157,1,1747609200,False,
UgzbjkH-yXaxP8RN9Ll4AaABAg.AIHRNA-q-WNAIHRscTwHPk,But if it’s not made here we can’t buy domestic,@michelejashinsky8409,1,1747609200,True,UgzbjkH-yXaxP8RN9Ll4AaABAg
UgxWNl2BKij8Y-BpYGh4AaABAg.AIHRK9TyRqzAIHVwpLWgFM,"Yeah, retire😂😂😂😂",@taylorkeane2295,1,1747609200,True,UgxWNl2BKij8Y-BpYGh4AaABAg
UgxqFmItrZUDmZL3lgR4AaABAg,Good analysis! You bring up some great points to counter their narrative! Always look forward to what you have to say.,@LateToTheGame27,1,1747612800,False,
UgwwYlmbowKh8GX8D894AaABAg,"omg bessent does that clearing throat thing every time he just or is about to lie. If I were his teacher and he said that he read the assignment and did that clearing throat thing along with his nervous explanation, no way would I believe him. You can read bessent like a book.",@midwestBlue,1,1747609200,False,
UgybP80jSCyPvXLC94F4AaABAg,Hi Chris how are you? Love your channel,@wendyderemiah7274,1,1747612800,False,
UgwmHlmn9mtdypD_4DF4AaABAg.AIHOrc0lGfeAIHeGHxHZos,A day nearer to the Grim Reaper 🙏,@peterarmstrong6928,1,1747614060,True,UgwmHlmn9mtdypD_4DF4AaABAg
UgyG86Q2NNb3WC7UEkF4AaABAg,The dictator is dicktating 🤣🤣,@peterarmstrong6928,1,1747613880,False,
Ugw8nMStRjOG0UAr5fJ4AaABAg,"What happen to our allies in Europe? no visits scheduled? No Deals being made?  This is all Garbage. This regime has to be pushed out.
Chris Thanks for speaking truth and legit info.",@theeardrafter,1,1747613820,False,
UgwOUOQtxR1HMPwl0Et4AaABAg,"And Mexico didn't pay for the wall, that was never built, but that Steve Bannon was charged with fraud for fundraising without building either....",@jeancharles788,1,1747614240,False,
UgxF7zS61WIKFKcozhR4AaABAg,"Scott Bessent is trying  to spin the negative effects of Trump's Tarrifs as a positive outcome for the US Economy, he'll learn soon that Trump's loyalty is one way !",@thiernoburwell2679,1,1747613880,False,
UgzttOTcCySo7SW_yyN4AaABAg,"Bassett is the WORST Treasury Secretary,  and a horrible liar. We don't deserve these guys and their BS.",@Shonsa716,1,1747616520,False,
UgxyTDiFQ8H0hyRIgRN4AaABAg,"Bessent speaks like a pobot, & doesn't seem to know what he's  talking about he's  just parating what trump wants 😢",@marthajones7236,1,1747615320,False,
UgwcOy-YGjut8c_cmRV4AaABAg,Im surprised i haven't heard of more people that stocked up around the election.,@CatDog1982,1,1747613880,False,
UgxibboByv9dkg8nGoB4AaABAg,6:19 I need to eat.  This is Bullshit...,@PonziZombieKiller,1,1747613880,False,
UgwVBVb36t1UeGq8Bjt4AaABAg,The entire Trump administration is Fascist Amateur Hour.,@DrRussPhd,1,1747614120,False,
UgwqvnCpOpYHsC3-arV4AaABAg,Dump and the Republican’s should write a book for history. “How to Ruin a Great Country in 4 months”!,@Eah-g2p,1,1747614120,False,
Ugz48sHIu3hPXu76e4B4AaABAg,"Here in California, gas prices are going UP!!!  We are seeing - for the first time in history - gas prices near or above $5.00 per gallon.  Chevron, Shell, Unocal 76 are ALL well above $5.00 per gallon.  Smaller gas stations are $4.90+. (Cash prices.  Add $0.10/gal. for credit card usage.)
Higher gas prices mean higher cost of EVERYTHING because it cost more to transport EVERYTHING.",@mikejones8866,1,1747616400,False,
UgwXN3AjTB1W_4xQnDV4AaABAg,"I live north of Atlanta, Georgia.  Gas went down a little bit, not significant.  I am retired and thank goodness I have a pension so gas prices do not concern me as much as the food and goods as they are higher.",@lianidri80,1,1747612800,False,
UgynQWPByOW8NuXe0Bd4AaABAg,"The assumption is that ALL consumers own cars so they’ll save on gas even as prices goods increase 

Millions of people use mass transit and can only afford food and shelter.",@laladeyarmin8553,1,1747612800,False,
UgzwRz6C7zzxcGGIM114AaABAg,im surprised any nation trusts getting into a 10 year deal with the u.s. Look what happened with mexico and canada. U.S closest allies and backstabbed lol,@bananas1318,1,1747615260,False,
UgxUGcy1g8o3pLTUpJ14AaABAg,"Trump is going to lie about the recession anyway.  Gas in northern Ca is 4.77/gal at Sams which is the cheapest.  Trump and the weird Bessent is FOS.  Dec it went down to 4.30/gal.  They need to stop lying, we have eyes.",@johnnieccrn6187,1,1747613880,False,
Ugwv-qyPcUGXz3M-0at4AaABAg,Is Bessent alive 🤔,@peterarmstrong6928,1,1747613880,False,
UgyfgBM0xraKGqM51nB4AaABAg,"Companies are going to lose money and employees will get laid off and everyone will be spending less. This is all Trump’s fault. Blaming Biden isn’t working anymore. As for myself, I’m buying necessities and keeping a roof over my head and that’s pretty much it.",@RBdreams1961,1,1747615200,False,
UgxXd9Ft0AW5xC1rUGd4AaABAg,Trump wants so desperately to pull everyone into his reality television shit show. Real economics be damned‼️,@OriginalBernieBro,1,1747616340,False,
UgyUWtW34mCmy0JuoSN4AaABAg,THIS IS A SHIT SHOW PERIOD!!!! HORRIBLE ACROSS THE BROAD YUCK 🤮😪😫😤😢😞🤮😪😫😤😢😞🤮😪😫😤😢😞🤮,@carlapaschall5768,1,1747612800,False,
Ugwyf4gVFJToUR1QpzB4AaABAg,"ANOTHER CON,  CON ARTIST RACISTS 😢😢😢😮YUCK 🤮🙄🙃🤧😤😒🤮🙄🙃🤧😤😒🤮",@carlapaschall5768,1,1747612800,False,
UgzAHNxqoXBnc7-o6Sd4AaABAg,Moody’s downgrade is the canary in the coal mine. Exorbitant privilege will crater with exorbitant debt. Winter is coming!,@SFRainmaker,1,1747613880,False,
UgxFbV50jq8qRWtXY3h4AaABAg,Get out protest,@lisastreit6890,1,1747615200,False,
UgxgBHSATIQJzOP-g-x4AaABAg,Bessent is a pathological liar,@cheesepie455,1,1747615080,False,
UgzdH9gIFUbHz8S68Vd4AaABAg,ALL LYING LYING LYING 🤥🙄😒😑YUCK 🤮🙄🙃🤧😤😒🤮🙄🙃🤧😤😒🤮,@carlapaschall5768,1,1747612800,False,
UgwKZPe-kOsvX9mn7N14AaABAg,never trust anything came out from trumps admin,@TrangNguyen-jp9xp,1,1747612800,False,
UgyqU34dfs870h6ZAFZ4AaABAg,Trump admit that american company who is paying the tariff and he asking them not to raise price by eating the tariff,@LukmanH-o6t,1,1747613820,False,
UgzFJ5t3glbqZcmnP3F4AaABAg,"It is offensive that these people think we are stupid, we fully understand what a tariff is and that we pay them.",@GeraldineRStack,1,1747612800,False,
UgzL1_UrVBhY4RT-pxl4AaABAg,There all such liars,@SharonKing-m9z,1,1747613820,False,
Ugwv029IjaynNh14ubJ4AaABAg,"Page one of the trump bible.
Cough, cough.
“If the price goes down, it’s because trump but if the prices increase it’s because of the previous government”",@LindsayBarker-vx8hw,1,1747614480,False,
UgwUr8QMt3mYh0sAnJ94AaABAg,Too many idiots in america. 😂😂😂,@YasminJunid-i8p,1,1747613700,False,
Ugys2uCZtbtsxMgTRjN4AaABAg,Trump is a total recall!,@Original_fat_cat,1,1747612800,False,
UgybgDhDfqBzSRt7SOd4AaABAg,What did the billionaire CEOs think would happen when they backed a 6 time loser with 6 bankruptcies  starting a tarrif war that would cripple them and their profits with the inept felon’s tarrif nonsense? It’s a tax paid by the consumer. People shop there because things are cheap and from China. Can they really be that dumb?astounding..,@gladitude9,1,1747613700,False,
Ugxwey4BslBZvnouVoF4AaABAg,"On Walmart's margins they, or lots of companies, can't eat Trump's shitty tariffs.
A tariff is a tax on consumers 
Trump and the Oligarchs are intent on giving themselves another tax break - it is the wealthy who should be paying their fair share not struggling families - this is exploitation, and often of the very people who voted for Trump and the Republicans.",@ChrismTwo,1,1747612800,False,
Ugz1iwK21cNTi-27qNV4AaABAg,You must all obey your King.,@vimy385,1,1747614420,False,
Ugy7c2DCt5gCw8IHY2Z4AaABAg,Trump is building out of the US so he can flee after his administration because he'll be procecuded.,@zorrosoberon,1,1747614360,False,
Ugy2AcMdVAUKkq5Hm8d4AaABAg,Scott Bessent is a lying clown. He doesn’t it have the guts to tell President Cheetos that his policies are stupidly. After this interview he must have had to change his diaper. HE TOLD WALMART TO EAT THE TARIFFS……BULLSHIT.,@VegabyOmer,1,1747614360,False,
Ugy-wnu91OgtK-AXciV4AaABAg,"Yes, Trump backed down -- big time. But what Bessent also said (paraphrased) is that neither he nor Trump knew that a 145% tariff would be ""unsustainable"" when Trump imposed them.",@scottymac734,1,1747614600,False,
UgzlUS4rFFj9awwuaGx4AaABAg,"The orange turd's entire cabinet are given a crash course in how to lie efficiently, repeatedly, and without an ounce of guilt. They're all shitting on the American people and telling them it's chocolate cake",@markcannon3899,1,1747614480,False,
UgwnodfjYHxEyNaY-EF4AaABAg,"I have not been, Shopping at, walmart target  amazon for Months and I will never go back!!!!!!!",@carlapaschall5768,1,1747612800,False,
UgzytxjI-U3NBGm20QV4AaABAg,"People, we eat the tariffs! Purely and simply! Someone tell Trump! Everyone, wake up! We are going to pay more for everything!  Gawd!😮",@judypyle6336,1,1747614360,False,
Ugxky4lW20bJ1U0oj0B4AaABAg,"Gas here in So Cal is $4.19/gal, about the same for a long time. Eggs have come back down a bit to abt $5.99/dz. Going out to eat is rare, usually costs $100 for 2 ppl. I don’t believe anything Bessent says.",@elpear,1,1747615500,False,
UgxNcvqggouTPHFkrjl4AaABAg,MAGA = M_orons  A_re  G_overning  A_merica,@mozlover5,1,1747614480,False,
UgwyRxkGlIGcKS0J09B4AaABAg,"Have Americans never before direct ordered any products from a country on which duty was applied and had to pay it? It seems like very few people understand what it is. In Canada for a great many years we paid quite high duty on US goods. When it was lowered we bought more, but now Trump says we were ""taking advantage"".  So I now shop UK and EU and those places don't refer to us as ""nasty"".",@Chahlie,1,1747612800,False,
Ugz21zo1mPorrjyRFCx4AaABAg,What do I think? My Bullshit Detector shot sparks and blew fuses. Bessent's words are the definition of 'gaslighting'. Who's stupid enough to be told what they think? Well....obviously I suppose the Dumpster Cult members are 🫤,@Ksane,0,1747613940,False,
