id,text,author,likes,timestamp,is_reply,parent_id
Ugyife5UfeBSyzR39g14AaABAg,Gas up.  $2.54 two weeks ago.  $2.79 and another place was $2.99 in MO,@SaraKeen-zi4qd,0,1747613580,False,
Ugyhhvd30CMussUNWo14AaABAg.AIHREtHqsRLAIHSxs1qZZM,The US is a nation of temporarily embarrassed millionaires..,@Eldritch-1,0,1747609200,True,Ugyhhvd30CMussUNWo14AaABAg
Ugxr8lOGaFmsdiXuPGl4AaABAg,"Gas is $4.59 a gallon where I live, not too low",@laserboneful,0,1747613580,False,
Ugwu56wLV1F_UAqL1Zx4AaABAg,How would trump and his administration not understand the tariff is inflationary and is imposed on consumers.,@antareschen4451,0,1747613580,False,
Ugyhhvd30CMussUNWo14AaABAg.AIHREtHqsRLAIHWCRXHHvu,"Of course the billionaires care, they actually need slaves to do the work for them.",@Farquare,0,1747609200,True,Ugyhhvd30CMussUNWo14AaABAg
Ugyhhvd30CMussUNWo14AaABAg.AIHREtHqsRLAIHWQiDKdNk,so god bless them,@sergimage1541,0,1747609200,True,Ugyhhvd30CMussUNWo14AaABAg
UgxDcqE-NTGOQpHCGBV4AaABAg,Of course they will try to eat as much of the consequence in their individual restructuring,@radboo4384,0,1747613580,False,
UgzXLr96nS2WaLYS97R4AaABAg,Ignorance is bliss...  Tyranny is mandatory...  Empire Collapse,@PonziZombieKiller,0,1747613640,False,
UgwyfTAgLzj8HkkHIGl4AaABAg,Walmart price the same just add importation Tax a.k.a Tariff tax get it MAGA . Trump and His Administration think all Americans are stupid and dumb like MAGA followers,@firechieffrancis6437,0,1747613640,False,
Ugyhhvd30CMussUNWo14AaABAg.AIHREtHqsRLAIHZT-S8Wcv,"@TheMic74key, unbelievable",@DRockCoolyhigh,0,1747612800,True,Ugyhhvd30CMussUNWo14AaABAg
UgwGNCghtxuOEMHcZMB4AaABAg,My wife and I retired about 4 years ago we can no longer afford to eat out. Just like the Reagon years we waited for 30 years for it to trickle down.( Didn't happen) now we have Trump making us rich and great again sure doesn't look like it's going to work. PS you're right he coughs before a lie',@johnretiredplumberl4921,0,1747612800,False,
UgwX9OGy98cRvBNHF954AaABAg,"Trump’s regime is a criminal enterprise. His cabinet is full of inept, self serving water carriers who are corrupt, so they will never answer questions, they will deflect, filibuster and do their best to avoid.",@gladitude9,0,1747612800,False,
Ugwob31aoRMnxWoxDU14AaABAg,That Dude needs to be tested for drugs alone with Low IQ Donnie Dunce and his administration crime family!,@manders652,0,1747609200,False,
UgzO2z_SK81yYWKd81p4AaABAg,These countries know that the U.S. is a sinking ship!,@smbeefjerky,0,1747612800,False,
Ugxfuv0VaWQqnxy9co54AaABAg,I wish people would listen to the truth thank you for the truth,@diane2060,0,1747612800,False,
Ugyk2_L1r9IDuPTAVRR4AaABAg,"that aluminum smelting plant in Oklahoma will END up like the FOXCONN plant in Wisconsin, guaranteed...",@smtpgirl,0,1747612800,False,
UgzgtXUvAYJ0ntQLpkp4AaABAg.AIHRVMQ82o9AIHX5ziRT5M,"Every time any MAGA opens their mouth, they lie.",@marycatherinecullenannmcdade,0,1747609200,True,UgzgtXUvAYJ0ntQLpkp4AaABAg
UgzgtXUvAYJ0ntQLpkp4AaABAg.AIHRVMQ82o9AIHjkYKO7mb,"He lies before, after and during the clearing of the throat.",@dyking2105,0,1747616880,True,UgzgtXUvAYJ0ntQLpkp4AaABAg
Ugw_UfNqfQK7fgOKRUR4AaABAg,Trump tweet at Costco please because their gasoline same price since election.,@bvrb4042,0,1747609200,False,
UgwW11O7rEJqv2ge14R4AaABAg,"We now live in an era where reality is made up on the spot. Maga just speaks BS into existence and bam, reality is created.",@jjohnson4301,0,1747612800,False,
UgynhJI-16ObxntzB2R4AaABAg,"The Walton Family has been so loyal to the Elephant 🐘 party.  When the Elephant 🐘 party decided China should become No.1, the Walton Family wasted no time, they began opening their Chinese Distribution Centers across America at a rate that wiped out American businesses like no other.
This is the thanks Trump gives them, that they should eat Tariffs?  Who does Trump think pays for the upkeep on their $300 Million Yacht, their $70 Million 250 GTO, their Mansions, their Private Jets?
Does Trump expect the Walton Family to dip into their wealth to pay these costs?",@amgguy4319,0,1747609200,False,
UgyNFP6IEjv-HqUImEV4AaABAg,Its a lie.  Gas prices have not gone down,@CondiBeans,0,1747609200,False,
Ugy6Pqz8mJrLGrneWHZ4AaABAg,No change on gas prices in my area which is Texas,@Johnsonvideos100,0,1747609200,False,
UgyhC1eHQbVePFju2a14AaABAg.AIHRPhUjwvtAIHabg22f4S,"Much of the oil the US uses to make fuel comes from Canada and instead of selling it to the US at a discount, they are now selling it to China, Japan, etc. for a better price. The stuff you still get from Canada is also tariffed so you have to pay more for it. You can thank Trump for all that. BTW, it will take years and billions of dollars to build the infrastructure in the US to process its own lighter type of shale oil into those fuels. I guess starting a trade war you were not prepared for might not have been such a good idea?",@DavidRussell-mz9yb,0,1747612800,True,UgyhC1eHQbVePFju2a14AaABAg
UgyJ-4VyuS3St7JlQCl4AaABAg.AIHRLsGPDH1AIHSVAtJK7C,[see],@robcraigmyle3892,0,1747609200,True,UgyJ-4VyuS3St7JlQCl4AaABAg
Ugz5NctR0gCTNfdTcmZ4AaABAg,"It’s hard for me to listen to Bessent too, it’s like nails on a chalk board",@laserboneful,0,1747612800,False,
Ugw1ecmcf7d-9j9sJ054AaABAg,"Trump   your  with out a doubt a ""IDOT"". Barnone.",@PouchPuncher-e6l,0,1747612800,False,
UgyGweOFf-8VT2U0m5h4AaABAg,The president gets away with throwing around huge numbers because it is not easy to wrap your head around much less for his followers,@ffcaesarrrr,0,1747612800,False,
UgwGXejXPz67PTBrIWd4AaABAg,What was Pet an trump signing,@diane2060,0,1747612800,False,
UgyNs28E6eyQcHXWrex4AaABAg.AIHRO2DXojZAIH_b_cdScg,"Much of the oil the US uses to make fuel comes from Canada and instead of selling it to the US at a discount, they are now selling it to China, Japan, etc. for a better price. The stuff you still get from Canada is also tariffed so you have to pay more for it. You can thank Trump for all that. BTW, it will take years and billions of dollars to build the infrastructure in the US to process its own lighter type of shale oil into those fuels. I guess starting a trade war you were not prepared for might not have been such a good idea?",@DavidRussell-mz9yb,0,1747612800,True,UgyNs28E6eyQcHXWrex4AaABAg
UgxlnDlrQ8hjutqaHON4AaABAg,"Trump acts like prices going up isn't exactly what he wanted to force consumers to buy from the US. Now your choice is buying expensive products from overseas or buy expensive products from the US. Trump is to thank for this, and Walmart bears no responsibility here.",@stevenlarson3316,0,1747612800,False,
Ugzz_BOkVanikbtE2Hx4AaABAg,Florida here. Gas has not gone down at all in my area. Grocery prices are going up. Hot dogs just jumped up $2 (for Nathan's),@goodkarma7405,0,1747612800,False,
UgznASWPOxEBYV6l3CB4AaABAg,That is part of Trump 34 felons,@diane2060,0,1747612800,False,
UgwYW5LepSW8U4gW6nJ4AaABAg,"If Walmart has to eat the tariffs it will soon be empty shelves ie no imported goods, only American goods. Will it be cheaper?",@jan-akesteen2126,0,1747612800,False,
Ugy3ygXiHV_xK0jEBkJ4AaABAg,Is it possible Trump can ruin the US any worse than what he did already  ??,@wildwilly1184,0,1747605600,False,
UgxRGDYPGq6GFgkkrih4AaABAg,Chris have you heard anything about the GE & Beoing deal with Etihad airlines? I had a MAGA friend throw that in my face. From what I know Airbus was out because of litigation between them and Etihad airlines.,@marksmith1784,0,1747605600,False,
Ugz8ajkPafW_adcdk7p4AaABAg.AIHQRvzGKPlAIHSjCCDfqf,Wait until the next  is raily false-flag kicks off Gulf War Final.,@robcraigmyle3892,0,1747609200,True,Ugz8ajkPafW_adcdk7p4AaABAg
Ugy_1B4mDmHtMJ1Vo8p4AaABAg,Gas is 5 dollars here.,@NiceToMeetCheuk,0,1747616040,False,
Ugx4Q4KiTaRhnyVMDQR4AaABAg,Yeah it’s true MAGA they are all idiots 😂 they would know what’s going on even if it was in their faces,@len6908,0,1747615980,False,
Ugx0vIxdEd8dhdU7_XF4AaABAg,You know where thr tariffs goes right?? Go to the Government pocket!!! We are paying the 30 percent extra on to of the tax!!!,@NiceToMeetCheuk,0,1747615980,False,
UgykAKtK7VyCvRtDagl4AaABAg.AIHPohMspZPAIHjySXfZTD,"You must mean $3.20, not $1.20",@dyking2105,0,1747617060,True,UgykAKtK7VyCvRtDagl4AaABAg
UgyiKX2wsBWJbMo0xph4AaABAg,"So now the admin tells businesses they make too much money. But we need tax cuts for millionaires and billionaires. This smacks of Communism. Nothing for the majority, almost everything for the few select.",@chronocommander007,0,1747605600,False,
UgwXSVUiZX1F0CaxRSx4AaABAg,D8647T,@barnyg6804,0,1747605600,False,
UgzWuh_vRen_KQfkX814AaABAg,"Mr. Bessent, who pays the TARIFFS?🤔🤔🤔🫤🫤🫤🙄🙄🙄🙄😰😰😰😰🥵🥵🥵🥵🥵then choked uh uh uh uh uh uh uh uh uh uh 😂😂😂😂😂😂😂",@victorchew151,0,1747615980,False,
UgwjVQEALngg_nLAiFh4AaABAg,I guess the hillbilly voters are still doing their USA chant???😜😜😜,@martinwolmarans1833,0,1747616040,False,
Ugyt8GjZBC4D6eQ21514AaABAg,Trump is doing all of this mess so the money will be going to his bank account  that he has over sea,@vanessaamous1366,0,1747616040,False,
UgzKgfBqh3ItbsdLtzp4AaABAg,This administration is like one of those agencies that setup mergers between 2 companies and makes bank whilst doing next to nothing.,@ndh06,0,1747605600,False,
Ugw_XRFBmljg7Z6i4fp4AaABAg,Bessent literally chokes on his lies.,@roxanna910,0,1747616100,False,
Ugwi3XkW6KBQoZsf_454AaABAg,Wonder if his voter base is paying attention yet??? 😂😂😂😂,@martinwolmarans1833,0,1747615920,False,
UgxrEBV32yKu0lBCiOx4AaABAg,whenever i see lutnick on some interview he reminds me of a town fair clown 'barker'..,@3Dimencia,0,1747616100,False,
UgzvZd9EQanrbqXVwgN4AaABAg,"This is self-inflicted why we even forced to have to choose which one ?  Gas — or — food ?  This is disingenuous and a disturbing way to run a country, I don’t see how it ends well",@AntalDarin-ly6os,0,1747616160,False,
Ugxj_7wlbFkcPuHVBXp4AaABAg.AIHPgxIOr-TAIHk1TfSfhI,Amazon Leaving America Behind. Just like Donald Trump wants No work for American's but please kiss his Ring. Donald Trump: I will bring jobs back to America! Everyone Business: We are leaving America.,@mattstansbeary3068,0,1747617060,True,Ugxj_7wlbFkcPuHVBXp4AaABAg
UgzktyHRuLInTajQ8HV4AaABAg,I don’t buy gas at Walmart,@davido566,0,1747616160,False,
Ugy8Um6Npf8TuaDN2pF4AaABAg,"The Saudi's are human right violators, they care only for their own religion and nation, they will befriend anyone they can use.  Stupid, ignorant Trump thinks they are his BFF's.  That plane is a bribe, and it is stuffed full of spyware because the big mouth trump can't keep a secret, where no doubt that SOB has already given them along with Jared his traitorous son in law and his equally ignorant stupid eldest spawn, nuclear and state secrets.  IMPEACH THAT SOB, GET HIM OUT OF OFFICE",@kasisatya5448,0,1747605600,False,
UgyCHlBvVk4lw8GPg9x4AaABAg,H has the nerve to complain about any company make a small profit when he made 10 times or more on ONE 1 trip to visit his favorite MAN.  He is just saying this and making up crap about 8 6 means anything other than just means trash it or throw away...  to divert his plans for this week.,@willaj8577,0,1747616220,False,
UgxO7LQCbNhEUAnJREp4AaABAg,"I am so sick of the tripe spewed out by these Trump, w*** over and over again makes me sick. The maggots wouldn't know the truth if it landed on them.",@wuzcrakin,0,1747616220,False,
UgzAxE18ywkMx8gw3k54AaABAg.AIHPdVCIzmAAIHRw95LnOa,Bessant is an idiot I cannot stand him lots of lies. Has he even graduated from college?,@zirfazal4668,0,1747609200,True,UgzAxE18ywkMx8gw3k54AaABAg
Ugx3-EHCBjtMNOOTGaV4AaABAg,"Wer bekommt das Geld der Zölle ?
Was passiert damit ?",@fam.kellermann1368,0,1747616280,False,
UgykAKtK7VyCvRtDagl4AaABAg.AIHPohMspZPAIHUnDrGTrj,​ @LorrenSquarrell-f8c Over 5$ a gallon here in northern Ca.,@alisonwright5724,0,1747609200,True,UgykAKtK7VyCvRtDagl4AaABAg
UgykAKtK7VyCvRtDagl4AaABAg.AIHPohMspZPAIHSrtnsvNt,​ @LorrenSquarrell-f8c not pay. He said they are up 1.20,@barbaralindhjem2488,0,1747609200,True,UgykAKtK7VyCvRtDagl4AaABAg
Ugyf1p4Tjuux_6XGv2l4AaABAg,I went grocery shopping I usually pay $125 today I paid $155 why I don’t bought the same items. It didn’t increase this much before 128 130 135,@Liesdontfoolme,0,1747605600,False,
Ugx-V12iiDZ3EXiFTa94AaABAg.AIHPotUdrssAIHer-C3fTm, @fmcg5364 Trump is cutting SNAP too. Both cuts have cut funds to US companies and farm with food already manufactured not being paid for.,@allangibson8494,0,1747614360,True,Ugx-V12iiDZ3EXiFTa94AaABAg
UgyOTjdCDyvk7K5rPgh4AaABAg,PLEASE SNL..... Make a skit with Will Ferrell playing Scott Bessent. We need this!!! 😂,@kunkmiceter,0,1747615800,False,
Ugx-V12iiDZ3EXiFTa94AaABAg.AIHPotUdrssAIHajzsjHth,trumph you are a piece of crap. 😊,@JohnAdie-pg6ky,0,1747612800,True,Ugx-V12iiDZ3EXiFTa94AaABAg
Ugx-V12iiDZ3EXiFTa94AaABAg.AIHPotUdrssAIHar5748BT,Lotta GREEDY PRICKS.  FUDT EPSTEIN FILES NOW FUDT,@JohnAdie-pg6ky,0,1747612800,True,Ugx-V12iiDZ3EXiFTa94AaABAg
Ugx-V12iiDZ3EXiFTa94AaABAg.AIHPotUdrssAIHbBfg6lxP,They MAGA ARE PURE EVIL.  WEIRDOS.,@JohnAdie-pg6ky,0,1747612800,True,Ugx-V12iiDZ3EXiFTa94AaABAg
Ugx-V12iiDZ3EXiFTa94AaABAg.AIHPotUdrssAIHbEUs3lxm,Cruelty is the point 🤬,@Flowerchild676,0,1747612800,True,Ugx-V12iiDZ3EXiFTa94AaABAg
UgzTQXVpcZFamLesCrZ4AaABAg,This TrumpTariff is nothing more than taxing the American citizen in order to pay off the massive debts the US Govt. has incurred for the past 7 glorified decades. In this world nothing is free except the air you breathe in... the Americans just have to deal with it... 😊😊😊,@apakansaja8505,0,1747615800,False,
Ugx-V12iiDZ3EXiFTa94AaABAg.AIHPotUdrssAIHbsbaCkFk,​ @jeanieologist4456 he's race baiting,@Epipusher007,0,1747612800,True,Ugx-V12iiDZ3EXiFTa94AaABAg
UgxIyZfLL2F7HxTIh0F4AaABAg,Ok people of America have you figured it out by now who pays the tariffs? Do you still think China sends a cheque to the American government?,@Bill-r9z,0,1747615800,False,
UgzN-wgQDAH2FkIy2aB4AaABAg,"In a democracy/capitalist society, corporations are allowed to set prices by themselves. Any government ""interfering"" with business decisions is ""taking over"" a free society.",@robertcox14,0,1747615800,False,
Ugx-V12iiDZ3EXiFTa94AaABAg.AIHPotUdrssAIHf9gV9vcv,"I thought the UK government was absolutely cruel, but even they give 2 years ramp down time when they cut a program or service. The US global image will never recover from this",@mrcead,0,1747614540,True,Ugx-V12iiDZ3EXiFTa94AaABAg
Ugz2Qxut-VUdCjjjQD54AaABAg,"bessent is a liar, just like trump.",@paladro,0,1747615920,False,
Ugx-V12iiDZ3EXiFTa94AaABAg.AIHPotUdrssAIHfFPUcs9m,He wouldn't walk across the street to save any of us. ​ @Doreen-u2n ,@elizabethalexander6528,0,1747614540,True,Ugx-V12iiDZ3EXiFTa94AaABAg
UgzfgOID_WbJJ5mR99x4AaABAg,Gas is $5.40 in CA. Where is it going down???,@mistyespinosa6003,0,1747615860,False,
Ugx-V12iiDZ3EXiFTa94AaABAg.AIHPotUdrssAIHgROxMC87,"@cent50aplusGive generously to the poor, not grudgingly, for the Lord your God will bless you in everything you do. Deuteronomy 15:10",@GareyGordon-p4y,0,1747615200,True,Ugx-V12iiDZ3EXiFTa94AaABAg
Ugx-V12iiDZ3EXiFTa94AaABAg.AIHPotUdrssAIHgasLECKH,the rich dont care about the poor!,@alexlim1275,0,1747615260,True,Ugx-V12iiDZ3EXiFTa94AaABAg
Ugx-V12iiDZ3EXiFTa94AaABAg.AIHPotUdrssAIHh-3X8m-l,TRUMP DOESNT CARE IF A FEW MILLION POOR KIDS STARVE BECAUSE THEY ARE NOT WHITE. HE IS FOCUSED ON ALL THE KIDS IN GAZA GETTING KILLED SO THEY CAN START HIS SEASIDE GAZA HIGH RISE HOTEL & CASINO.,@WolfmanMack,0,1747615500,True,Ugx-V12iiDZ3EXiFTa94AaABAg
Ugx-V12iiDZ3EXiFTa94AaABAg.AIHPotUdrssAIHi1UwAcek,I thought the court ordered them to finish their previous pledges?,@Sheworkshardforthemoney,0,1747616040,True,Ugx-V12iiDZ3EXiFTa94AaABAg
Ugx-V12iiDZ3EXiFTa94AaABAg.AIHPotUdrssAIHjhQVF8OI,"​ @mrcead ,  ok you're talking about a Tory government.",@mireillelebeau2513,0,1747616880,True,Ugx-V12iiDZ3EXiFTa94AaABAg
Ugx-V12iiDZ3EXiFTa94AaABAg.AIHPotUdrssAIHjroyj-3t,​​@alexlim1275 👍 The rich don't care about anyone!,@mireillelebeau2513,0,1747617000,True,Ugx-V12iiDZ3EXiFTa94AaABAg
UgwrRDDvdcBXkE5armB4AaABAg,Do NOT obey tyrants!!!!!!!!!!!!,@robertcox14,0,1747615860,False,
UgwxORFJmAlPVCELuNl4AaABAg,Walmart isn't fucking with you Donna. Why should Walmart eat your tariffs and you keep making money. Your some new kind of fool to even fix your mouth to say something that stupid. It's time to get head checked for all sense's.😮😮😮😮😮,@LaMorrisRender-lk3sv,0,1747616280,False,
UgzzY4VHbJJ4UMZIf5p4AaABAg,What amazes me is how foreign nations are even making deals. They are literally paying the US taxes to export products to the US. If i was a foreign nation i would simply drive up prices of products to the US and collect the profits. Its better keeping the money in the country at the expense of exports than subsidising foriegn nations debt at the cost of competition. The big mistake the Chinese did was play by tge US rules. If the US wabt more expensive products from China so they can be competitive. Then charge more for your products and make more profits.,@justindressler5992,0,1747616340,False,
UgzAxE18ywkMx8gw3k54AaABAg.AIHPdVCIzmAAIHSw7cMj3_,He can't lie straight in bed,,0,1747609200,True,UgzAxE18ywkMx8gw3k54AaABAg
UgwCY8cBGTdNkIWVQcF4AaABAg,"The Trump Tax is going to hit soon, going to be hard to deny it.",@JeepsyPainter,0,1747616880,False,
Ugz2zvHTsTp03wMSGPp4AaABAg,That’s cringe. This guy wants us to acknowledge what an incredible trip they had. “ I hope you guys took a lot of pictures “ 😅😆🤣,@AntalDarin-ly6os,0,1747616700,False,
Ugwezm790kfRUlNl7nV4AaABAg,Gas prices HAVE COME DOWN ... IN  TRUMP'S MIND!!,@stutzbearcat5624,0,1747616760,False,
Ugx8K7BNyySuEzKhhvt4AaABAg,Understand Republicans are lying like a rug what is so hard to understand about that,@G-S-D,0,1747616760,False,
Ugw1MzjMfHMA7ui5uUZ4AaABAg,"Grocery prices are way too high, gas prices are up, jobs are down where I am at. We need help and I think that he should increase SNAP to help people eat.",@fmcg5364,0,1747616760,False,
Ugyhkcmyj5JXVcH2NBF4AaABAg.AIHPDDhDGmWAIHSK-LZx4b,If Bessent was honest he wouldn't work for Trump. Instead he's just another toady ruining his own life for the Big Orange Idiot.,@silverinkpot7,0,1747609200,True,Ugyhkcmyj5JXVcH2NBF4AaABAg
UgwCbEc-6M0XcHkkLEh4AaABAg,The crown prince is a chonker,@ElitaSue,0,1747616760,False,
UgyglPSR9BJd26N2ltJ4AaABAg,When have you ever seen prices go down ?,@hanaisalontan,0,1747616820,False,
UgzNo_fvIUCWl93UIhF4AaABAg,I don’t understand how they live in California that just collapse here prices are gone up $.30 in the last two days.,@TrinoOrtiz,0,1747616880,False,
UgwK0rFx1cjspJbnrNh4AaABAg,If you check around your home in your closets you will be really surprised just how much stuff you have from dishes to towels to electronics to cloths and then imagine if those made in China things suddenly disappeared from your house what would you have left 😮,@SherriSlater-v1v,0,1747616880,False,
UgwOZ5D1dHiNiw69r094AaABAg,China pays import tariffs for USA goods and the USA pays the tariffs on Chinese goods entering the USA so whats the confusion?,@keviniwankow8294,0,1747616940,False,
UgxmbBR0H89GTvqeWPF4AaABAg,"It appears, Dump47th and his Administration have created a horrible economy for Americans.   They created the tariffs war.

""American companies — that pay tariffs, and the money goes to the U.S. Treasury. Those companies typically pass their HIGH COSTS on to their CUSTOMERS  in the form of HIGHER PRICES.""",@harmonyandpeacetranquility7851,0,1747616400,False,
UgzmQHwr8681uF1OCNl4AaABAg,We KNOW who pays the tarrifs.    WE  Americans DO. !,@eweizenbaum5999,0,1747616940,False,
UgwmHlmn9mtdypD_4DF4AaABAg.AIHOrc0lGfeAIHPkQTfwCZ,"Yes on us the citizens of USA, the maggot magas have already been paid off, corrupt traitors that they are.",@kasisatya5448,0,1747605600,True,UgwmHlmn9mtdypD_4DF4AaABAg
UgxjWT7p6CcAS3HTjRV4AaABAg,"Walmart won't eat the tariffs, but at least they arguably could. 

Smaller businesses? Most don't have the reserves.",@merphul,0,1747616940,False,
UgxKKwkKBC66HztZ2Lp4AaABAg,"So damn annoying Trumpers believe his tariff spin, a blindfolded chimp with a pencil in its hand could have figured this out.",@KG84C,0,1747617000,False,
UgzZ_qKqakhou15KMaZ4AaABAg,"Scott Bessent: China 🇨🇳 aside which we just have a GREAT NEGOTIATION DUEL in Switzerland, the rest of the world will be receiving either a LOVE Letter or a NASTY Letter indicating whether they will be receiving Preferential treatment or a go-to-hell wake-up call after ripping off USA for donkey years! 😮",@NoodleWan7701,0,1747617000,False,
UgwD2PkXBTgHGPwtNyp4AaABAg,So this nutjob destroyed everything n now complaining about his fuk ups,@kennethdavis1209,0,1747617023,False,
Ugw5z65FYpVcyoDGakF4AaABAg,"IMO, Chris, gasoline is going down a few cents in some places, because of demand. Demand is down because trucks aren't rolling, people aren't vacationing, ships aren't sailing and airplanes aren't flying. Because planes are crashing, goods aren't moving, and people are afraid of a recession. And the reason. Trump and tariffs.",@osolomeyo3471,0,1747617032,False,
UgywCPtRGziPIF6e66N4AaABAg,Thanks for sharing!👏🏿👏🏿🔥🔥💥💥💙💙,@Venger02,0,1747617039,False,
UgwmHlmn9mtdypD_4DF4AaABAg.AIHOrc0lGfeAIHcx4eChuK,Lord I can only hope so. I have no faith in the American people. You would think after all the goddamn s*** Trump done he would never have a chance to win again but here we are. So you have a goddamn American idiots put that SOB back in the office just like they'll put the goddamn dumb f**** Republicans.,@donivanpotter2762,0,1747612800,True,UgwmHlmn9mtdypD_4DF4AaABAg
Ugy83ccD-PO6t8jGiQZ4AaABAg,"Is there no way that the public can sue these people for telling lies and deceiving the public? The Trump Administration is outright telling false information, causing losses to US businesses.",@tonneblack5168,0,1747605600,False,
UgwFl-Btui_tjfXnAGd4AaABAg,666 is trump devil 😈 number.,@raymondwilmont8103,0,1747605600,False,
Ugx06cR5SdEpDKa7BRl4AaABAg,Listening further I'm in meltdown listening to bessent.😅,@victorchew151,0,1747616700,False,
UgznaqlppKRvzKfzKtR4AaABAg.AIHPUDjmiTxAIHSLJlsVuH,Legacy media is owned by people just like Trump.,@Eldritch-1,0,1747609200,True,UgznaqlppKRvzKfzKtR4AaABAg
UgzgbOrYh6VEGBAgTcx4AaABAg,"Scott Bessent is aging in real time.  Can you imagine how old he's going to look by the end of the summer?  Everything Donald Trump touches, DIES.",@larryjones9773,0,1747616400,False,
UgyNJU0_aZaK_n4TWwl4AaABAg,"Gas prices are UP to over $5/gallon in NorCal. Give me a break!! Nothing but lies, sorry Donald you can't have an airplane.  You are FIRED!!!",@Shonsa716,0,1747616400,False,
Ugye3JHVibIL6cbf4GJ4AaABAg,"Is Saudi Arabia were really wealthy, they could put their workers in housing other than labor camp style.",@TaxTheChurches.,0,1747616400,False,
Ugz8_c5yzzEm1kEBGBh4AaABAg,"Smoking mirrors,and lie lie lie",@larrylemmon4873,0,1747616400,False,
UgzBYOfAEqj0f6EqW-t4AaABAg,I bought gas this morning and gas prices have not collapsed.  Sorry to tell him he's got wrong information.,@amberpoulson2143,0,1747616400,False,
Ugwrk5hcm1mGE0gYgz14AaABAg,What a crock of BS. He is the worst liar.,@mariontimmins5421,0,1747616400,False,
Ugzm22u5Yvh-701K2cR4AaABAg,"The model with these big box stores is that the producer eats some of the tariffs, the retailer eats some of the tariffs and the consumer eats some of them. Do I care about gasoline prices? Sure. Egg prices? Sure. Egg prices have come down a lot. Property taxes are still going up. Cars are going up. Car insurance is going up. Homeowners insurance is going up. Energy prices went up like mad this past winter. Our place in MA had a $700+ natural gas bill for one month.",@movdqa,0,1747616460,False,
UgzAxE18ywkMx8gw3k54AaABAg.AIHPdVCIzmAAIHYR8tL59r,"He s a Republican!
Cowards, liars and cheats!",@caroljones5334,0,1747612800,True,UgzAxE18ywkMx8gw3k54AaABAg
UgzAxE18ywkMx8gw3k54AaABAg.AIHPdVCIzmAAIHareIPxSP,"G'day,

Bessant 
The
Pissant.....;
With
Lutnick
The
NutLick-er...

Just(ifiably ?) sayin',

Such is life.

Have a good one...

Stay safe.

;-p

Ciao !",@WarblesOnALot,0,1747612800,True,UgzAxE18ywkMx8gw3k54AaABAg
UgyC4t6s15Xxhb8vuhp4AaABAg,But trump said we’d all get RICH when OTHER countries pay the tariffs! Did he LIE to us? MAGA,@1961Bullet,0,1747616460,False,
UgyACK7WaKPbl0IoqSV4AaABAg,"Wesentlich für den Ölpreis ist, dass die Opec+ den Preis künstlich drückt, um der US-Ölindustrie den ""Gar auszumachen"" .",@fam.kellermann1368,0,1747616520,False,
UgzAxE18ywkMx8gw3k54AaABAg.AIHPdVCIzmAAIHehWA4job,And he is creepy.,@johnnieccrn6187,0,1747614300,True,UgzAxE18ywkMx8gw3k54AaABAg
UgwoaYIIn64YFkrBzwJ4AaABAg,"Why would anyone need to ""eat"" anything?  We've been told for over a month that China was paying for these and that we were ""making so much money off of them"".  The moving of the goalposts on this issue as their narrative collapses is next level.",@scarletspider1240,0,1747616520,False,
Ugy8VWr4Hw0IjtKl23x4AaABAg,Recent poll show trump is the most hated human on the planet 🙄 in the world 🌎,@raymondwilmont8103,0,1747605600,False,
Ugx3u_1z9NX1dfqgP-h4AaABAg,"You can’t eat gasoline God, these sycophants Make mesick.",@jeanieologist4456,0,1747605600,False,
UgxByK9vXjxdjhmm66R4AaABAg,"Orange guy says egg prices went down 98% here in Wisconsin a dozen of eggs still $8.00 bucks and gas and electricity are up, what’s he talking about, bunch of liars.",@LuisZarate-w3y,0,1747616520,False,
Ugza2QmImbbNIiLgsXt4AaABAg,"Mexico didn’t pay for the wall.
China won’t pay for the tariffs.
Taxpayers do.",@jakubpiwowarski9145,0,1747616580,False,
