id,parent,text,like_count,author_id,author,author_thumbnail,author_is_uploader,author_is_verified,author_url,is_favorited,_time_text,timestamp,is_pinned,replies,is_reply,parent_id
UgxkCZo4lIMdxpeRFJ54AaABAg,root,What about somme israeli jewish historian who were zionist and now support palestinians? Mr. Murray,1,UCIenO1pXYBi5Gs8FAc7ipig,@PC-ONE,https://yt3.ggpht.com/U_8-3wC76tHefuKi62Gbrh9smNxwq91Z1F8q_Nkal0uQKRXjsI6qURQr2AEuME8dVtTTMfsZ7CQ=s88-c-k-c0x00ffffff-no-rj,False,False,https://www.youtube.com/@PC-ONE,False,4 weeks ago,1745280000,False,[],False,
UgyCUWtJbWJfY4LEpzJ4AaABAg,root,"That 'someone else' Joe was talking to...is TIM DILLON........An awesome, comedian, podcaster....with a realistic view of the world told ina funny, sarcastic way........please pay him his dues.....",0,UCMGJHR_fc9vqYLmykQjx1KA,@goonerross4834,https://yt3.ggpht.com/ytc/AIdro_lTjWu-3Nr3rnVWW3pjtTt92B02C81EFsYtH532LAAnVfdL_xLvCVos3GLgui6Fba6opw=s88-c-k-c0x00ffffff-no-rj,False,False,https://www.youtube.com/@goonerross4834,False,4 weeks ago (edited),1745280000,False,[],False,
Ugx0x-952qhbuK6ZOYF4AaABAg,root,"I think it s better if you let us watch discussion and then let us hear your comments.
The video seems more like a message to someone than a podcast to everyone",0,UCCn0E9EweZx6ZmFiWIiYQkQ,@Cmustang22,https://yt3.ggpht.com/ytc/AIdro_lIohKYD5XjwuBAfAy5Am67nbZsRFM00kKJYdpwVw=s88-c-k-c0x00ffffff-no-rj,False,False,https://www.youtube.com/@Cmustang22,False,4 weeks ago,1745280000,False,[],False,
UgyAxYKHy3r6L4J_Y6h4AaABAg,root,Don't talk about MARS unless you have been there.,3,UC0k2SNrx-PG-cxydyKNKGTg,@usmaansial,https://yt3.ggpht.com/STuwgcGpSiOx8xQ949fvZhcL_5z2lppiWQjyjyoLWm4uUdOboT081oV65HOczZB1RJXl7qdY2g=s88-c-k-c0x00ffffff-no-rj,False,False,https://www.youtube.com/@usmaansial,False,4 weeks ago,1745280000,False,[],False,
Ugx3HASOPRyBmoWje2J4AaABAg,root,Has this Murray thug been to Auschwitz,0,UC2JI6Lxtj7qXdF6BokR_e3g,@user-zg9up8kw4v,https://yt3.ggpht.com/ytc/AIdro_nO5_AnrR5wC3yikrkeRVMEqqK2JYLnvMQub5cKxd-mCQNDacSpJv5wGRkTMh4pgO6TqQ=s88-c-k-c0x00ffffff-no-rj,False,False,https://www.youtube.com/@user-zg9up8kw4v,False,4 weeks ago,1745280000,False,[],False,
UgzlLTgHe6zxuDx3e6l4AaABAg,root,"Yes, Douglas Murray has been to North Korea, and also Iraq, Ukraine, Gaza, Israel and Lebanon. This information cost me only 10 seconds to find, which was obviously too much time for you, so you just are talking BS about Douglas Murray, who spent much much more time than 10 seconds to visit all those countries.",0,UCk3gB2c3fJIV5C3y5l3x9DQ,@ParryPappel,https://yt3.ggpht.com/T1pirgUPrHvkKcbeHmjr4FAbI2Qmfai79xDiqVz4tNp9lMUp9bZPucVLlSXwOCuflkUS0M5kww=s88-c-k-c0x00ffffff-no-rj,False,False,https://www.youtube.com/@ParryPappel,False,4 weeks ago,1745280000,False,[],False,
Ugypx2sLYGoUhIKs7sN4AaABAg,root,Gutless Murray really needs to focus on being Dame in a Christmas panto. He is not a journalist. He is a complete joke.,1,UCq2Zuc4-_xNJXWZXKLVzQRg,@dealwithit207,https://yt3.ggpht.com/ytc/AIdro_mO-FmweL8y1uNqqNcUDZ4M2Un4LX2rU-rFLpju9-lPnEwniZbZVQiSSLxwVY_IJGv2Ww=s88-c-k-c0x00ffffff-no-rj,False,False,https://www.youtube.com/@dealwithit207,False,4 weeks ago,1745280000,False,[],False,
UgzVwoXVwN-Qajit7E94AaABAg,root,Zio media is going onto overtime to salvage his career. 😂😂😂😂😂,1,UCg3_f8lLIee7ctkk0pigP2w,@adnaanu,https://yt3.ggpht.com/ytc/AIdro_mAuEkUL4rkTS89HOAvcDkme8XUpbppLsg1c0E3FXg=s88-c-k-c0x00ffffff-no-rj,False,False,https://www.youtube.com/@adnaanu,False,4 weeks ago,1745280000,False,[],False,
UgyGnDOsPeCX9C0mXkN4AaABAg,root,Be careful people are being arrested left right and centre for being pro Palestine,1,UCF8Femx5xRnOWQyYrgKbgxg,@Asad-2166,https://yt3.ggpht.com/rupTlQa6xJ0C_ZhnfXvpPbJ_WOn1TNM3HQfMo2hwyXlJgsV9svfjBerGMkm2IbxhIGuENMTDKQ=s88-c-k-c0x00ffffff-no-rj,False,False,https://www.youtube.com/@Asad-2166,False,4 weeks ago,1745280000,False,[],False,
UgwDTHEI-GMHmoK2llJ4AaABAg,root,Murray has never been to Iran but he talks about it endlessly.,1,UCH0rVnPpsNW39Bd16_HBZdg,@Mrhasbarafree,https://yt3.ggpht.com/ytc/AIdro_lqybv1ymmQZzV-g7nROuYqYvRtqWJrzgIBL02smStPjjYqrzc547dVBcr4Ak5lP7MDAg=s88-c-k-c0x00ffffff-no-rj,False,False,https://www.youtube.com/@Mrhasbarafree,False,4 weeks ago,1745280000,False,[],False,
UgyQ9IzOL8XLzYas5bt4AaABAg,root,Please get a refund from Oxford Uni.,1,UCCaX_nQENiwAwj_K7TPenEQ,@APC-pm2on,https://yt3.ggpht.com/ytc/AIdro_lX8hGR0DidczwHp-0thPO-SPMaF9lIlK7HGc5nwuyQU1w=s88-c-k-c0x00ffffff-no-rj,False,False,https://www.youtube.com/@APC-pm2on,False,4 weeks ago,1745280000,False,[],False,
UgxW51Ttfg0aE9ShrTp4AaABAg,root,Yeaaaah 🔥,0,UC0Nyb5DxJ2GhJhwF98ceZ2w,@camilominon,https://yt3.ggpht.com/4GbKk9Gp3auQHKV4TKcdpUYsitJMl0U6GnGBpwzDxS58Sctvewhhqf55TNe1Viv1Zolezk4xxg=s88-c-k-c0x00ffffff-no-rj,False,False,https://www.youtube.com/@camilominon,False,4 weeks ago,1745280000,False,[],False,
UgyvGpMC3Nj8Zc-QE3R4AaABAg,root,"Ayo Zee , we need more of those lakshmi ""cow poo "" vids 😂",0,UCCzwFTDqOiS2OnzPLZaIeHw,@solomongrundy3676,https://yt3.ggpht.com/ytc/AIdro_mbdw79JGc5mlEFb4L_fDS_eNfnZ3cB5TODqlDQLt_5YWQ-7_FLklstw7UB2tMe0YfK6w=s88-c-k-c0x00ffffff-no-rj,False,False,https://www.youtube.com/@solomongrundy3676,False,4 weeks ago,1745280000,False,[],False,
UgzIOEZgdd3X8oGq8NB4AaABAg,root,"If a Muslim state were to commit the same crimes against humanity as Israel, I would be calling them an apartheid state too.
no matter which Religion, Ethnicity, Nationality, background you come from, you can't be silent or support the kind of crimes Israel has already committed and continues on to do.
The Apartheid state of Israel needs to go away.",0,UCuGyw9qqU0r_jkPTov80sbQ,@RiriRara-id7zt,https://yt3.ggpht.com/ytc/AIdro_nG4SbiRinF1vfW-o9Rnw5llJVk7TkcI6fsy_QOXjoibee1KSsh76gul9To0U7W2NWuBQ=s88-c-k-c0x00ffffff-no-rj,False,False,https://www.youtube.com/@RiriRara-id7zt,False,4 weeks ago,1745280000,False,"[{'id': 'UgzIOEZgdd3X8oGq8NB4AaABAg.AHA9LA7eTzrAHA9gHmtBJb', 'parent': 'UgzIOEZgdd3X8oGq8NB4AaABAg', 'text': 'The following are incidents performed by islamic jihadists within the last two years.  (So, we are not even getting into centuries worth of atrocities here.)  (All of these incidents have been reported and recorded by govenment officials and church leaders):\n\n- The surprise bombing, out of nowhere of Israel.\n\n- An Islamist group has admitted guilt to the very recent msssacre of 133 innocent people in Russia.\n\n- According to a 2024 report by the International Society for Civil Liberties and Rule of Law, 2023 marked the bloodiest year on record for Islamic attacks against Christians in Nigeria, with more than 8,000 killed and thousands more abducted and forcibly displaced, including dozens of priests.\n\n- The destruction of churches and hindu temples in India\n\n- The very recent attack of 70 catholics in their church in the Congo.    They were beheaded. (Many of them women and children)\n\n- The destruction of chuches, schools, villages, as well as abductions and violence in Africa\n\n- Chaos perpetrated by Islamists in Indonesia and Lebanon\n\n- The recent massacre in New,Orleans took place by an admitted Isis member.\n\n- The ongoing continued vile hatred toward Jews. The use of terms such as ""the river to sea"" (calling for the eradication of the Jews out of their own land) as well as the teaching of muslim children in the middle east to hate the Jews\n\n- The ongoing fighting within their own sects in the middle east. (Muslims can\'t even get along with rheir own in the middle east.)\n\n{Folks, if you don\'t think there is something seriously wrong in this cult, I don\'t know what to tell you.}\n\nTo give further insite into what is happening in Africa, the following: From international news within the last two years. ""A Catholic priest gave testimony in Spain to the extreme persecution the Christians of Burkina Faso are undergoing due the violence and pressure of Islamic jihadists attempting to drive the Christian population out of the western African country. “Since the first attacks in 2015, Christians can no longer freely exercise their right to religious freedom,” Father Wenceslao Belem said at the Cathedral of Almudena in Madrid, Spain. Since the terror began, more than 2,000 schools have been closed,” he continued. “They attack modern schools by turning them into daaras [Islamic Quranic schools]; attack Catholic churches by killing or abducting Christians, especially catechists, priests, and other committed lay people. And they want to impose the wearing of full-face veils on all women, regardless of religion. Many Christian girls have to go to school with the veil to avoid being branded, slandered, beaten or even kidnapped.” Detailing the ever-present dangers involved in attending Mass on Sundays and the risks for priests and faithful who must travel for access to the sacraments, the priest said, “On Sundays and feast days, the police, the military or volunteers, surround the churches so that we can pray and celebrate Holy Mass without danger. On the roads leading to the villages, terrorists lay explosive mines to prevent us and the military from accessing us. Thus, they can continue to isolate populations that will suffer hunger and need if they do not convert to Islam.” Belem stated that priests go to confession before leaving their houses for fear they may be killed before returning. “Going to the villages and giving pastoral assistance to the populations is already very dangerous. We have to pray a lot, receive the sacraments, confession, before we go to give pastoral assistance in case we do not return"".', 'like_count': 0, 'author_id': 'UCS6kNdttftFQpdjwBPjTZlQ', 'author': '@agnesfox8349', 'author_thumbnail': 'https://yt3.ggpht.com/ytc/AIdro_kCyMHO6uEOZgHPJCU9iRgmfqmjaJYD9vvEbAz2k6Y=s88-c-k-c0x00ffffff-no-rj', 'author_is_uploader': False, 'author_is_verified': False, 'author_url': 'https://www.youtube.com/@agnesfox8349', 'is_favorited': False, '_time_text': '4 weeks ago', 'timestamp': 1745280000, 'is_pinned': False, 'is_reply': True}]",False,
UgzIOEZgdd3X8oGq8NB4AaABAg.AHA9LA7eTzrAHA9gHmtBJb,UgzIOEZgdd3X8oGq8NB4AaABAg,"The following are incidents performed by islamic jihadists within the last two years.  (So, we are not even getting into centuries worth of atrocities here.)  (All of these incidents have been reported and recorded by govenment officials and church leaders):

- The surprise bombing, out of nowhere of Israel.

- An Islamist group has admitted guilt to the very recent msssacre of 133 innocent people in Russia.

- According to a 2024 report by the International Society for Civil Liberties and Rule of Law, 2023 marked the bloodiest year on record for Islamic attacks against Christians in Nigeria, with more than 8,000 killed and thousands more abducted and forcibly displaced, including dozens of priests.

- The destruction of churches and hindu temples in India

- The very recent attack of 70 catholics in their church in the Congo.    They were beheaded. (Many of them women and children)

- The destruction of chuches, schools, villages, as well as abductions and violence in Africa

- Chaos perpetrated by Islamists in Indonesia and Lebanon

- The recent massacre in New,Orleans took place by an admitted Isis member.

- The ongoing continued vile hatred toward Jews. The use of terms such as ""the river to sea"" (calling for the eradication of the Jews out of their own land) as well as the teaching of muslim children in the middle east to hate the Jews

- The ongoing fighting within their own sects in the middle east. (Muslims can't even get along with rheir own in the middle east.)

{Folks, if you don't think there is something seriously wrong in this cult, I don't know what to tell you.}

To give further insite into what is happening in Africa, the following: From international news within the last two years. ""A Catholic priest gave testimony in Spain to the extreme persecution the Christians of Burkina Faso are undergoing due the violence and pressure of Islamic jihadists attempting to drive the Christian population out of the western African country. “Since the first attacks in 2015, Christians can no longer freely exercise their right to religious freedom,” Father Wenceslao Belem said at the Cathedral of Almudena in Madrid, Spain. Since the terror began, more than 2,000 schools have been closed,” he continued. “They attack modern schools by turning them into daaras [Islamic Quranic schools]; attack Catholic churches by killing or abducting Christians, especially catechists, priests, and other committed lay people. And they want to impose the wearing of full-face veils on all women, regardless of religion. Many Christian girls have to go to school with the veil to avoid being branded, slandered, beaten or even kidnapped.” Detailing the ever-present dangers involved in attending Mass on Sundays and the risks for priests and faithful who must travel for access to the sacraments, the priest said, “On Sundays and feast days, the police, the military or volunteers, surround the churches so that we can pray and celebrate Holy Mass without danger. On the roads leading to the villages, terrorists lay explosive mines to prevent us and the military from accessing us. Thus, they can continue to isolate populations that will suffer hunger and need if they do not convert to Islam.” Belem stated that priests go to confession before leaving their houses for fear they may be killed before returning. “Going to the villages and giving pastoral assistance to the populations is already very dangerous. We have to pray a lot, receive the sacraments, confession, before we go to give pastoral assistance in case we do not return"".",0,UCS6kNdttftFQpdjwBPjTZlQ,@agnesfox8349,https://yt3.ggpht.com/ytc/AIdro_kCyMHO6uEOZgHPJCU9iRgmfqmjaJYD9vvEbAz2k6Y=s88-c-k-c0x00ffffff-no-rj,False,False,https://www.youtube.com/@agnesfox8349,False,4 weeks ago,1745280000,False,,True,UgzIOEZgdd3X8oGq8NB4AaABAg
Ugz3BoCxcbPQT0I_0zJ4AaABAg,root,The whole birthright thing with sponsored trips now comes to mind. That would’ve been the perfect way to seal generational loyalty.,0,UCJDi_tX7NF3v2T_NrGb2v4A,@no_prisoners1,https://yt3.ggpht.com/Pj-qMNwYO5mQfkDsbX-_M9wROcQrH6vlrYhVtbrKn7Ye2OwmB7JYTmYsf13NFO-DOhy87fvelQ=s88-c-k-c0x00ffffff-no-rj,False,False,https://www.youtube.com/@no_prisoners1,False,4 weeks ago,1745280000,False,[],False,
UgyGORgBiZzM4D4gqk54AaABAg,root,"Dear brother I like your work, but why do you wear Gucci on your head? Gucci is a boycott and you shouldn't advertise them and certainly not ""honor"" on your head.

Esselâmu Aleyküm",0,UCMZ4d1nLYjAGtli75HylOdQ,@M.M.sav.571,https://yt3.ggpht.com/Ezj9WE49Pp44S-DHIAQnJIVc5xtADnzFTEz8rO39ThHXW09M4xNZpkAa6P526D8hhkHzRqMZXg=s88-c-k-c0x00ffffff-no-rj,False,False,https://www.youtube.com/@M.M.sav.571,False,4 weeks ago,1745280000,False,[],False,
UgzjWRHJsBs1bsCyATh4AaABAg,root,so we need to be an expert to call holocaust a holocaust? or a layman also says so?,0,UCZ8BRhUKqEGBgFdUgX0mIEA,@yasinjamal7517,https://yt3.ggpht.com/_PBYf7Adfk_ukKSi3nnBfWICxI5xRkrO4xCSA7Hq0B-3BWstiIyDdPi3d97fH_g6ECh1wkyUX_o=s88-c-k-c0x00ffffff-no-rj,False,False,https://www.youtube.com/@yasinjamal7517,False,4 weeks ago,1745280000,False,[],False,
Ugwo0aIgkEzJ9iIIozF4AaABAg,root,That’s was funny looool,0,UCrZOz6cEQqnCm9LTID4My1A,@dawiser1,https://yt3.ggpht.com/ytc/AIdro_n2sQW7X_fmVqnVQobd70MYlUHYc_qeAxRgNzysDhPCIw=s88-c-k-c0x00ffffff-no-rj,False,False,https://www.youtube.com/@dawiser1,False,4 weeks ago,1745280000,False,[],False,
UgzOo4WlAKEf3DIXahR4AaABAg,root,100000 people died... maybe go and ask them? They paid the ultimate price and they maybe became experts all of a sudden? Go and ask their relatives the pain that they have gone thru,0,UCeMhljAxQPLPfie8rRtQOjQ,@OzkanE-tc1gq,https://yt3.ggpht.com/ytc/AIdro_mty4LOIvUzXpPrsED6aRD1v7R5qvwb1KztYpQ1HWrVAfcTt6_MSzSZmCzyuxdJ9P4pHg=s88-c-k-c0x00ffffff-no-rj,False,False,https://www.youtube.com/@OzkanE-tc1gq,False,4 weeks ago,1745280000,False,[],False,
Ugx5dIo95JnyM4MIrN14AaABAg,root,"I'm not a veterinarian,  but I know what dogs and rats and snakes and  pigs and weasels are, and I know a lot of facts about them...I also know that they all live in Israel.",2,UCXXksC6N3AjvC0WlzogAF_w,@SamA-ep9go,https://yt3.ggpht.com/ytc/AIdro_kM1DUmSj94cGXC-B-s0f---aCQW4UnHWaOqanfaR4=s88-c-k-c0x00ffffff-no-rj,False,False,https://www.youtube.com/@SamA-ep9go,False,4 weeks ago (edited),1745280000,False,[],False,
UgwAe-MCEkQRmNQNiYx4AaABAg,root,وَعَلَيْكُم السَّلَام وَرَحْمَةُ اَللهِ وَبَرَكاتُهُ,0,UC8Y74Chz836eYSh0eytEXeA,@aali8874,https://yt3.ggpht.com/ytc/AIdro_lhdax9i-RnA2nsMcqfTKimfQk1zyFsoINXqpOyp9A=s88-c-k-c0x00ffffff-no-rj,False,False,https://www.youtube.com/@aali8874,False,4 weeks ago,1745280000,False,[],False,
Ugzo0Z77WA0eTpnjj3d4AaABAg,root,lol mugless durray won't be going back onto JRE anytime soon 😂,0,UCfsTuzvM3O9wPX083FtFxHQ,@baejisoozy,https://yt3.ggpht.com/NBPl49ZLMl_sOV_0pQFmb7fCJO9c_14mJb7EOfTjytmydTHj1JqIT9YPee9QFCHAOnCpyg6P=s88-c-k-c0x00ffffff-no-rj,False,False,https://www.youtube.com/@baejisoozy,False,4 weeks ago,1745280000,False,[],False,
Ugx6oU9o1JHiBVi8F2l4AaABAg,root,"I've never been to the moon, so can't say if America landed on the moon!!",5,UCoGD9IV6TUMf5odl5p6JaFg,@As_Aasif,https://yt3.ggpht.com/R6ZpWMfYwiUoNAqFO43pXnbin0S4tHua7a2A_C-aaIO45XoxVYaBGSaZyLMMtSlHc0-9sCbCag=s88-c-k-c0x00ffffff-no-rj,False,False,https://www.youtube.com/@As_Aasif,False,4 weeks ago,1745280000,False,[],False,
UgzUfx_7OoydGB9uZeJ4AaABAg,root,"Great propaganda, pedo lover 😂",0,UC8P3B5f66WktkHGEvbVpzLQ,@hellboyy99,https://yt3.ggpht.com/Lrzt1FveZNKSpH5bw_4afRmGTW-G0q3QSB0bxag0zckhBzcxi7lJ1usGd08C1tiKmrx2sV-A=s88-c-k-c0x00ffffff-no-rj,False,False,https://www.youtube.com/@hellboyy99,False,4 weeks ago,1745280000,False,[],False,
Ugx-idqgVQPlQfB2vaZ4AaABAg,root,YOU'VE NEVER BEAAAAAN🤔🤔,0,UCDgoE2V6IktzOhX-03WNcOQ,@arsenictastesprettygood9844,https://yt3.ggpht.com/ytc/AIdro_nVB-UkGk2qfPJO74xJ7HeRtc2YZvo2O_6PvFyNI6nujIE=s88-c-k-c0x00ffffff-no-rj,False,False,https://www.youtube.com/@arsenictastesprettygood9844,False,4 weeks ago,1745280000,False,[],False,
Ugz_UrmbeL6_HWVYAIZ4AaABAg,root,Being invited to be toured around the country by the oppressors would make your opinion bias... not informed.,1,UCLxVky6OTK4Dli-vV135LfQ,@Acesahn,https://yt3.ggpht.com/ytc/AIdro_k4tTcSE9CpTX8heP5kDwLL6xH3a43zNCyK9CWzNLfpHeA=s88-c-k-c0x00ffffff-no-rj,False,False,https://www.youtube.com/@Acesahn,False,4 weeks ago,1745280000,False,[],False,
Ugx9wNdriOVnZkIb88R4AaABAg,root,People in the world are really stupid for believing Podcaster,0,UCLAbRkO8igppl-wD1qtT7UA,@elizehauptfleisch7542,https://yt3.ggpht.com/ytc/AIdro_ngtjMOp25fhosI6y6ctt66-l8_fqrdNyoviv4dF5g=s88-c-k-c0x00ffffff-no-rj,False,False,https://www.youtube.com/@elizehauptfleisch7542,False,4 weeks ago,1745280000,False,[],False,
UgzZrLDHnNp_redg3nt4AaABAg,root,MORREY ONLY WENT TO ISRAEL BUT NEVER SET HIS FOOT ON PALESTINE HE AINT KNOWS NOTHING,0,UCRUZ8ip59qbSlA_et0FVWKA,@mrgrumpycat9049,https://yt3.ggpht.com/ytc/AIdro_nnRuUc-3rYBYx0MOQ6tGfzrnWJMNR6Ck-_IRgxklkCg5o=s88-c-k-c0x00ffffff-no-rj,False,False,https://www.youtube.com/@mrgrumpycat9049,False,4 weeks ago,1745280000,False,[],False,
UgwTNkc38PwGdoB0tEV4AaABAg,root,You never beeewnnn?!?! 😂😂😂😂😂😂,0,UCAgnaTrxg19YUCZHcsDDfbA,@dracofunneh2498,https://yt3.ggpht.com/ccxp1bNoUos4Datbdiu4fRrF9Ds7hZ999udDLDeLStu2DHgeomzDxU4Kkd_EUwGDOnmqDSMX4-w=s88-c-k-c0x00ffffff-no-rj,False,False,https://www.youtube.com/@dracofunneh2498,False,4 weeks ago,1745280000,False,[],False,
Ugym-PsmWaJIDFB3Os14AaABAg,root,Douglas Murray is an expert in being the bottom .,1,UCM0y9S5TnWEfAgmxWNnuTxA,@fa_ti_maa9610,https://yt3.ggpht.com/ytc/AIdro_kFcvAcH5ihxeH3wOWuMzQSQ598uNr9jiNZBUc-6WY5UiQ=s88-c-k-c0x00ffffff-no-rj,False,False,https://www.youtube.com/@fa_ti_maa9610,False,4 weeks ago,1745280000,False,[],False,
UgySqmVUrt5ZOzDKMZt4AaABAg,root,Clearly abduls in the comments didn't watch the debate 🤣🤣🤣,0,UC1rwkXADXbaO54aenfN5luw,@POTATO-025,https://yt3.ggpht.com/dk76WAhX3rwXc86J9VrY8gMBL9QWa8CfqWIowtYxJBqpxyvx5J6lj2xKcJetnKQDkcmjjcpFDDs=s88-c-k-c0x00ffffff-no-rj,False,False,https://www.youtube.com/@POTATO-025,False,4 weeks ago,1745280000,False,"[{'id': 'UgySqmVUrt5ZOzDKMZt4AaABAg.AHA-0QcmydhAHA0zaFXetG', 'parent': 'UgySqmVUrt5ZOzDKMZt4AaABAg', 'text': 'But have you beeeeeewn therr!', 'like_count': 0, 'author_id': 'UCi2MnuVFHRHPRaeItNp7Liw', 'author': '@Trickyksa', 'author_thumbnail': 'https://yt3.ggpht.com/7eh4wgVoos45OxTFD0YnHX3Uh6NyRNURPNR0sLyV9DKcwSJ_0RBzLzC7eCRBOh34VvCc9ytRtyI=s88-c-k-c0x00ffffff-no-rj', 'author_is_uploader': False, 'author_is_verified': False, 'author_url': 'https://www.youtube.com/@Trickyksa', 'is_favorited': False, '_time_text': '4 weeks ago', 'timestamp': 1745280000, 'is_pinned': False, 'is_reply': True}]",False,
UgySqmVUrt5ZOzDKMZt4AaABAg.AHA-0QcmydhAHA0zaFXetG,UgySqmVUrt5ZOzDKMZt4AaABAg,But have you beeeeeewn therr!,0,UCi2MnuVFHRHPRaeItNp7Liw,@Trickyksa,https://yt3.ggpht.com/7eh4wgVoos45OxTFD0YnHX3Uh6NyRNURPNR0sLyV9DKcwSJ_0RBzLzC7eCRBOh34VvCc9ytRtyI=s88-c-k-c0x00ffffff-no-rj,False,False,https://www.youtube.com/@Trickyksa,False,4 weeks ago,1745280000,False,,True,UgySqmVUrt5ZOzDKMZt4AaABAg
UgyFtwyxdMY_UtRzOvR4AaABAg,root,"Smug Douglas Murray is very very very bitter that people prefer information from podcasts than funded journalists in this new age. Douglas came here specifically to have a whinge as to why he is not as successful or well received ad Joe Rogan et al. Yes Douglas, you may want to work on your undeveloped social skills and unregulated emotional meltdowns than come onto a successful podcast and tear others down with wild contradictions because you are in a deep insecure panic.",0,UCrrGikN5DaFsnptL2BznvTw,@Trackstareman23,https://yt3.ggpht.com/ytc/AIdro_lxaBT1smyiWmarqwyubN21yRiLhPVNdInsCCs403cUUMM=s88-c-k-c0x00ffffff-no-rj,False,False,https://www.youtube.com/@Trackstareman23,False,4 weeks ago,1745280000,False,[],False,
UgxMDVXeP2lHTJgT-Zt4AaABAg,root,❤❤,0,UCclDeDH2keIeUUD7jwvG6sA,@SHAIKTAUSEEFARREHMAN,https://yt3.ggpht.com/TuR_WtYrhI4S_mHU4YmFtP5XEKgP82TkUP6fIO-SiaOt2TNeozwlmF_Jrj8lXl7Cwls6b7IV=s88-c-k-c0x00ffffff-no-rj,False,False,https://www.youtube.com/@SHAIKTAUSEEFARREHMAN,False,4 weeks ago,1745280000,False,[],False,
UgyQIEWihZOBedicMfd4AaABAg,root,"So American conservatives do not know how to discuss and debate with anyone who is not gay.😂
It turns out they are equally dumb 😂😂😂😂😂😂",0,UCaT7Os7nuecdDjACi5zOHDg,@Hassan_1_28,https://yt3.ggpht.com/wiMObe34w3pLB_tgLGyWoOfM3dVFOuFoqC9nFPCBvq9wdnpr1kW19-NDtQwDUxQWXNmvq2dI=s88-c-k-c0x00ffffff-no-rj,False,False,https://www.youtube.com/@Hassan_1_28,False,4 weeks ago,1745280000,False,[],False,
UgwrYfUTFz5qmQDDEpd4AaABAg,root,"Murray is an ego maniac with a better pot to p in, however, he is quite right about many of his observations. If you wish to speak about a serious subject like war, politics philosophy etc you do not ask a comedian for his opinion.:face-green-smiling:",2,UClyenlNAGKcLogt0rPjcBTw,@kumar2ji,https://yt3.ggpht.com/ytc/AIdro_lajm0Gqk5BpmpajmdP8L1J-W16ggC02LryQF-al9j-hCw=s88-c-k-c0x00ffffff-no-rj,False,False,https://www.youtube.com/@kumar2ji,False,4 weeks ago (edited),1745280000,False,[],False,
Ugwhmycv022dzsgGcSt4AaABAg,root,Zionist Homosexual.,0,UCbSS6NZdxG0I_c7KwHL7kPQ,@arif8967,https://yt3.ggpht.com/ytc/AIdro_kIY49H3DpvRLurhWtK5oJM9zL9ItAroH1BY9uPfIyRiDg=s88-c-k-c0x00ffffff-no-rj,False,False,https://www.youtube.com/@arif8967,False,4 weeks ago,1745280000,False,[],False,
Ugxb_py00pqVbA6NLkN4AaABAg,root,Gutless Murray became a meme after these stupid arguments. It’s befitting.,1,UCCZka86w5q8mZCjJQg9oIKg,@Madridista8585,https://yt3.ggpht.com/y9uvm5Se3qNTRTjwioGm-mERkNQdhF1AegA64BLXaRpnZIJUmG_Wxw0rPBvsJ6fER8Y53vWoTeU=s88-c-k-c0x00ffffff-no-rj,False,False,https://www.youtube.com/@Madridista8585,False,4 weeks ago,1745280000,False,[],False,
Ugw4YhsqblH1Vwj5OyJ4AaABAg,root,"Regarding the damage control, you forgot to mention Trump promoting his book on X…
It is well known Trump doesn’t know how to read, so it seems the revolving door includes his Oval Office as well… 😂😂😂😂😂",2,UCCZka86w5q8mZCjJQg9oIKg,@Madridista8585,https://yt3.ggpht.com/y9uvm5Se3qNTRTjwioGm-mERkNQdhF1AegA64BLXaRpnZIJUmG_Wxw0rPBvsJ6fER8Y53vWoTeU=s88-c-k-c0x00ffffff-no-rj,False,False,https://www.youtube.com/@Madridista8585,False,4 weeks ago (edited),1745280000,False,[],False,
UgyF4LiWcuvfZ6l_lkF4AaABAg,root,Douglas Murray on one occasion says people who never seen holocaust narrated better accounts of the events than those who experienced holocaust 😂 crushing his own point,0,UCT3f2B1CLi2QKR-EKuJ6G6g,@VoiceSriLanka,https://yt3.ggpht.com/97G7sRjNUStRdmX1bo3tKwBHXCueUFJkOpWXADLuN3DbPwcCJG14hIyoTm2aJX8xWWfk4GprJ_A=s88-c-k-c0x00ffffff-no-rj,False,False,https://www.youtube.com/@VoiceSriLanka,False,4 weeks ago,1745280000,False,[],False,
UgxjhCWYohfWePNzrAZ4AaABAg,root,As a Palestinian living in Palestine 🇵🇸 I’ll welcome David smith so he can sit where he wants and say he’s “beaaann” here 😂,1,UCppJ8kWNpJWtWfJlm1g9oCQ,@Sicariouz,https://yt3.ggpht.com/ytc/AIdro_mhpdt52gf-ewuMICMSpf58jqqKXetktX-rAgmJkXZktJrVu4vDkBYngfAtIfmb6uJy3w=s88-c-k-c0x00ffffff-no-rj,False,False,https://www.youtube.com/@Sicariouz,False,4 weeks ago,1745280000,False,[],False,
UgyHmwOhRs3qqNZU5_p4AaABAg,root,YOU'VE NEVA BEAN!?!? 🥫,2,UCcdjmnjaeorclZJM6iQP9Rw,@kinetic3971,https://yt3.ggpht.com/fVWiR-1mrzmwq1leVa7-80XirUVWgE4k0avaJ_apB9BWOnLGZ9WjRQx6D4IIYbtU8Khs09affg=s88-c-k-c0x00ffffff-no-rj,False,False,https://www.youtube.com/@kinetic3971,False,4 weeks ago,1745280000,False,[],False,
